Sno,Tweet,Date,Likes,RTs,Sentiments
3808,RT I would only speak if I felt that I could be heard TV legend and philanthropist Oprah Winfrey discusses what she would say to P,2018-03-12 14:20:13,0,221,0
3809,RT Betsey DeVos basically paid for her position I think she s not the right person for this says Florida shooting survivor David,2018-03-12 14:20:13,0,2226,1
3810,RT A liberal Super PAC is digging up dirt on hundreds of incumbent Republicans running in local races across the country de,2018-03-12 14:20:13,0,1159,1
3811,RT Ivanka Trump never cut ties with the Trump Organization That s turned into a problem FireIvanka,2018-03-12 14:20:12,0,57,0
3812,RT Betsey DeVos basically paid for her position I think she s not the right person for this says Florida shooting survivor David,2018-03-12 14:20:12,0,2226,1
3813,RT Trump growth plan is working it s keeping the Trump rally going,2018-03-12 14:20:12,0,20,0
3814,politics makes us dumb this is only the effect of it taking its toll in your mind,2018-03-12 14:20:12,1,0,-1
3815,Digital Lobbying Can Washington be Automated,2018-03-12 14:20:12,0,0,0
3816,RT Russian defector says Putin has a hit out on Chris Steele s head Also claims Putin s ordered the killing of,2018-03-12 14:20:12,0,1202,0
3817,RT PM president to get their own planes by early 2020,2018-03-12 14:20:12,0,8,1
3818,RT A growing of countries appear to have significant leverage over the Trump WH The admin hasn t hesitated to sell out our in,2018-03-12 14:20:12,0,147,1
3819,RT This article makes the exact same argument about Farrakhan that Hamas supporters make about Hamas concerns about anti Semi,2018-03-12 14:20:12,0,81,1
3820,Canadian government to launch first review of nation s port authorities with focus on security,2018-03-12 14:20:11,0,0,1
3821,RT It s neither victory of federalism nor Balochistan It is umpire s victory Democracy loses today Zarda,2018-03-12 14:20:11,0,38,-1
3822,Well we let capital markets decide the alternate being what government setting all salaries be,2018-03-12 14:20:11,0,0,0
3823,RT As we celebrate WomensHistoryMonth we reflect on women s incredible contributions to our Nation We honor women s legacy,2018-03-12 14:20:11,0,1383,1
3824,RT Are they saying that there s a correlation between brain damage and pro immigration politics,2018-03-12 14:20:11,0,1,0
3825,RT 20 In conclusion yes everyone in mainstream politics everyone who lives outside the Fox Breitbart bubble NEEDS exposure to,2018-03-12 14:20:10,0,728,0
3826,RT I was denied a ticket to accommodate someone who dances in Bollywood Leaving a party for whatever the reasons may be but,2018-03-12 14:20:10,0,41,0
3827,RT Raise Your Hand If You Knew 45 Was Never Ever Going To Help Get Mass Murdering Killer Guns Out Of The Hands of Crazi,2018-03-12 14:20:10,0,17,0
3828,RT This is a powerful first person account from a Parkland doctor who treated the wounded,2018-03-12 14:20:10,0,795,1
3829,RT In 2016 Kamala Harris Arrested a Man for a Crime He Didn t Commit Now it s Revealed that She Did it to Protect Muslims,2018-03-12 14:20:10,0,2460,0
3830,RT Anecdote driven takes on free speech and political correctness are missing the real trends there is no campus free sp,2018-03-12 14:20:10,0,85,1
3831,RT Here s a crazy story Utah GOP passed a new bylaw to try to block Romney but now have discovered it could mean that no cand,2018-03-12 14:20:09,0,15,-1
3832,RT Betsey DeVos basically paid for her position I think she s not the right person for this says Florida shooting survivor David,2018-03-12 14:20:09,0,2226,1
3833,RT Is president Donald Trump keeping America great Keep America Great USA Maga QAnon At Pennsylvania breaking polit,2018-03-12 14:20:09,0,91,1
3834,Typical Republican politics First says he wants background checks and a ban on bumpstocks and,2018-03-12 14:20:09,0,0,1
3835,Washington Memo The President and the Porn Star A Story s Slow Rise Above the Din For nearly two months Stormy D,2018-03-12 14:20:09,0,0,-1
3836,RT Many Congrats to newly elected SenateChairman Sadiq Sanjrani Its a defeat for the fascist politics adapted by PMLN le,2018-03-12 14:20:09,0,33,1
3837,Very humble submission Sir When Mayawati ji is allying with Samajwadi Party whose MLAs ripped off,2018-03-12 14:20:09,0,0,-1
3838,RT Ivanka while working at the White House is getting paid 1 5 million annually by Trump companies which in turn are doing b,2018-03-12 14:20:09,0,694,0
3839,FOM 64 projected turnout for 18 March presidential election Russia,2018-03-12 14:20:09,1,0,0
3840,RT How can wealth persuade poverty to use its political freedom to keep wealth in power Here lies the whole art of Conservat,2018-03-12 14:20:09,0,298,1
3841,RT Vince Cable Tory and Labour MPs are considering defecting to the Lib Dems over Brexit Come on Soubry how about,2018-03-12 14:20:09,0,13,0
3842,RT I ll be home late this week This experience has changed me However I m more motivated as ever to continue to follow my,2018-03-12 14:20:09,0,1,1
3843,RT NBC Qatari officials gathered evidence of what they claim is illicit influence by the UAE on Jared Kushner and other,2018-03-12 14:20:09,0,491,-1
3844,RT Another reason for US to withdraw from UN Hitler religion slavery continues even today and not one objection,2018-03-12 14:20:08,0,1,0
3845,Khanday He damaged his credibility by joining politics There is nothing left now for him to d,2018-03-12 14:20:08,0,0,0
3846,RT 4 DeVos extended family has given to a variety of Christian and or conservative causes but religious education is most,2018-03-12 14:20:08,0,408,1
3847,The 64 most outrageous lines from Donald Trump s untethered Pennsylvania speech,2018-03-12 14:20:08,0,0,-1
3848,RT Context Is economy doing well under Trump Yes Was it doing well when he took over Yes America has added 2 5 million,2018-03-12 14:20:08,0,188,0
3849,RT UK must concede everything for US trade deal,2018-03-12 14:20:08,0,343,0
3850,RT And racist with Dame in front of her name spewing rubbish again,2018-03-12 14:20:07,0,1,0
3851,Crunching the numbers,2018-03-12 14:20:07,0,0,0
3852,Oh the wonderful feat of using identity politics continues it s,2018-03-12 14:20:07,0,0,1
3853,RT The 2nd most despicable character in UP politics Naresh Agarwal Second only to Azam Khan is allowed entry into,2018-03-12 14:20:07,0,745,1
3854,RT Who is going to keep Wilbur from falling asleep at the meeting,2018-03-12 14:20:07,0,11,0
3855,RT Ivanka Trump never cut ties with the Trump Organization That s turned into a problem FireIvanka,2018-03-12 14:20:07,0,57,0
3856,My Henry Survival Rifle 22 and my AR 15,2018-03-12 14:20:07,1,0,0
3857,While Democrats are busy playing identity politics losing at every turn and trying to impeach a duly elected Pres,2018-03-12 14:20:07,0,0,1
3858,RT J amp K finance minister Haseeb Drabu sacked reportedly for his Kashmir remarks Times Now,2018-03-12 14:20:07,0,4,0
3859,RT Two former EPA administrators Bush and Obama era write letter to Scott Pruitt who now has same job to ask him to back do,2018-03-12 14:20:07,0,147,0
3860,RT To have real accountability to restore the rule of law we need the attorney general to do his job and a,2018-03-12 14:20:07,0,46,1
3861,Trump spoke to a Russian activist about ending sanctions just weeks after launching his campaign via,2018-03-12 14:20:06,1,1,0
3862,Let the fear mongering and mud sliding begin ON,2018-03-12 14:20:06,0,0,0
3863,Japan s war fears worst in five decades,2018-03-12 14:20:06,0,0,-1
3864,RT UK must concede everything for US trade deal,2018-03-12 14:20:06,0,343,0
3865,RT We uncovered bizarre new details about the Trump Russia NRA connection,2018-03-12 14:20:06,0,785,1
3866,RT How much BS can be squeezed into one speech A lot The 64 most outrageous lines from Donald Trump s untethered Pennsylvania s,2018-03-12 14:20:06,0,3101,-1
3867,Just to clarify hor is this a test balloon Parliament Fares likely to rise as Govt spends more to improve publi,2018-03-12 14:20:05,0,0,1
3868,Top Beijing official Li Fei to lead newly renamed Law and Constitution Committee sources,2018-03-12 14:20:05,0,0,1
3869,RT prashant You R right actually politics in them has killed the human s,2018-03-12 14:20:05,0,1,1
3870,RT This article makes the exact same argument about Farrakhan that Hamas supporters make about Hamas concerns about anti Semi,2018-03-12 14:20:05,0,81,1
3871,RT A liberal Super PAC is digging up dirt on hundreds of incumbent Republicans running in local races across the country de,2018-03-12 14:20:05,0,1159,1
3872,RT This article makes the exact same argument about Farrakhan that Hamas supporters make about Hamas concerns about anti Semi,2018-03-12 14:20:05,0,81,1
3873,RT Funny to me that 18 is apparently too young to talk about politics but old enough to buy an AR 15 NeverAgain marchfo,2018-03-12 14:20:05,0,2163,1
3874,The question is not should our talks be political We don t get to choose They simply are and always have been,2018-03-12 14:20:05,0,0,0
3875,Dark perhaps for the immoral Liberal politics A breath of fresh air to PC s,2018-03-12 14:20:05,0,0,1
3876,RT Ivanka Trump never cut ties with the Trump Organization That s turned into a problem,2018-03-12 14:20:05,0,28,0
3877,RT Classic on Farrakhan,2018-03-12 14:20:05,0,4,1
3878,RT Betsy DeVos is a shining example of everything that is horrendous with the Trump Administration She is simply not fit to be,2018-03-12 14:20:05,0,859,-1
3879,News Trump says Commerce secretary will talk tariffs with EU,2018-03-12 14:20:04,0,0,0
3880,RT Trump growth plan is working it s keeping the Trump rally going,2018-03-12 14:20:04,0,20,0
3881,No Immediate Push to Raise Minimum Age for Buying Assault Rifles Trump Says,2018-03-12 14:20:04,3,4,0
3882,RT A pro gun Democrat could win in Trump country Where does that leave gun control activism,2018-03-12 14:20:04,0,9,1
3883,From Rielle to Stormy a tale of two scandals,2018-03-12 14:20:04,0,0,0
3884,RT KUSH THREAD Qatar claims to have EVIDENCE of illicit influence by the UAE on Jared Kushner amp other Trump associat,2018-03-12 14:20:03,0,547,-1
3885,RT 3 DeVos comes from a sect that historically believes that public education is akin to socialism,2018-03-12 14:20:03,0,577,0
3886,RT super interesting read on YouTube s algorithm,2018-03-12 14:20:03,0,37,1
3887,RT Naresh Agarwal is most notorious Aya Ram Gaya Ram most opportunist amp Most Foul Mouthed leader He is among the filth of In,2018-03-12 14:20:02,0,40,1
3888,RT Context Is economy doing well under Trump Yes Was it doing well when he took over Yes America has added 2 5 million,2018-03-12 14:20:02,0,188,0
3889,I mean Curtis Yarvin is Jewish no Or partly And certainly not left wing Following,2018-03-12 14:20:02,0,0,-1
3890,RT Japan PM wife s name removed from documents in suspected cronyism scandal media,2018-03-12 14:20:02,0,945,0
3891,you talk about politics and gun right gtfoh you sick asshole,2018-03-12 14:20:02,0,0,-1
3892,Family Politics NEVER Gets Old,2018-03-12 14:20:02,0,0,1
3893,RT My case is in the court of law for 5 years now But let my battle not be an excuse to humiliate other women In fact let i,2018-03-12 14:20:02,0,101,-1
3894,RT 399 Asif Zardari The King Of Politics AikZardariSabPeBhari,2018-03-12 14:20:02,0,1,0
3895,RT Public feedback has changed the History of Pakistan s Politics PTIStandsForBalochistan,2018-03-12 14:20:01,0,4,0
3896,RT I came of political age during the Cold War and can t recall successive American presidents meeting with Soviet leaders b,2018-03-12 14:20:01,0,4,-1
3897,RT Gun law in Fl getting all the ink but Gov also signed bills weakening teachers unions expanding school vouchers https,2018-03-12 14:20:01,0,44,0
3898,RT NBC Qatari officials gathered evidence of what they claim is illicit influence by the UAE on Jared Kushner and other,2018-03-12 14:20:01,0,491,-1
3899,Joe Manchin voting to confirm Jefferson Beauregard Sessions as US Attorney General,2018-03-12 14:20:01,0,0,1
3900,RT In the face of the dangerous policies and negligence of the administration in Washington we will use our jurisdiction to p,2018-03-12 14:20:01,0,129,-1
3901,RT The first NAFTA deal took 30 months to be approved while the wants a deal next month and John Weekes o,2018-03-12 14:20:01,0,1,1
3902,This administration wants to destroy the planet we all live on,2018-03-12 14:20:01,0,0,1
3903,RT UK should set date for everyone to speak English says Casey,2018-03-12 14:20:00,0,11,0
3904,RT Tories attempt and fail to smear as too close to Russia when Senior Tories are accepting russian dona,2018-03-12 14:20:00,0,226,-1
3905,RT Poisoned Russia Spy says Putin has a hit out on Christopher Steele Browder among others Good flag by,2018-03-12 14:20:00,0,1372,1
3906,Trump is committed to rewarding America s enemies and punishing its friends via,2018-03-12 14:20:00,0,0,1
3907,Indiana s teachers have suffered a 15 pay cut over the last 15 years This is not only unacceptable it s embarra,2018-03-12 14:20:00,2,1,0
3908,This is usual politics in our country what is there to discuss on this Wasting prime time opportunity,2018-03-12 14:20:00,0,1,-1
3909,NEW Commons chief apologises for giving impression parliament was in denial over bullying claims,2018-03-12 14:20:00,1,0,1
3910,Downstate Illinois vote could be primary election key for both parties,2018-03-12 14:20:00,0,2,1
3911,As the nations of the West have become increasingly multiracial their politics have grown more polarized,2018-03-12 14:20:00,1,0,1
3912,This is how parliament s set up allows bullying,2018-03-12 14:20:00,0,1,0
3913,RT SushmaSwaraj keeps dignity above politics her latest tweet against NareshAgarwal is winning hearts check out https,2018-03-12 14:20:00,0,7,1
3914,RT Context Is economy doing well under Trump Yes Was it doing well when he took over Yes America has added 2 5 million,2018-03-12 14:20:00,0,188,0
3915,RT f If you want my job apply for it here Feel free to chat to me about it if you re interested it s a v sm,2018-03-12 14:20:00,0,19,1
3916,RT This article makes the exact same argument about Farrakhan that Hamas supporters make about Hamas concerns about anti Semi,2018-03-12 14:20:00,0,81,1
3917,RT Betsy DeVos is a shining example of everything that is horrendous with the Trump Administration She is simply not fit to be,2018-03-12 14:20:00,0,859,-1
3918,NYT reports that Trump peace plan will be significant step backwards from Clinton parameters and Arab Peace Initiat,2018-03-12 14:20:00,0,0,1
3919,RT Republicans are trying to get 127 Democrats thrown off the ballot in one of Texas biggest counties,2018-03-12 14:19:59,0,92,0
3920,RT 2batch What would BJP politicians call this Urban Maoist Suicides or Politically Motivated Suicid,2018-03-12 14:19:59,0,17,0
3921,RT The face of the GOP South Carolina Candidate Proud of Confederacy and Slave Owning Ancestor,2018-03-12 14:19:59,0,630,1
3922,RT 2 DeVos married to heir to the Amway fortune has spent a lifetime trying to tear down public schools It s done in the,2018-03-12 14:19:59,0,999,-1
3923,Stick to politics Bernie,2018-03-12 14:19:59,0,0,0
3924,RT Ivanka while working at the White House is getting paid 1 5 million annually by Trump companies which in turn are doing b,2018-03-12 14:19:59,0,694,0
3925,Talk to someone under 20 about politics and you ll see that Education Secretary Betsy DeVos has after Trump the h,2018-03-12 14:19:59,161,89,0
3926,i haven t told you guys about something i think about a lot Susan is my favourite writer in the whol,2018-03-12 14:19:59,4,0,0
3927,RT I m honestly speechless MondayMotivation,2018-03-12 14:19:58,0,601,1
3928,RT Poisoned Russia Spy says Putin has a hit out on Christopher Steele Browder among others Good flag by,2018-03-12 14:19:58,0,1372,1
3929,RT Show and tell and shoot Teacher brings his AR 15 to school Students bring one too on their 18th birthdays Even sooner if t,2018-03-12 14:19:58,0,358,0
3930,RT Shocking no one Paul Ryan s rushed tax scam is so screwed that his corporate overlords are already demanding a fix Ap,2018-03-12 14:19:58,0,226,-1
3931,Everything is possible in love and politics,2018-03-12 14:19:58,0,0,1
3932,You despise California because 1 The majority of OUR PEOPLE voted against you 2 To do what s RIGHT for OUR PEOP,2018-03-12 14:19:57,0,0,1
3933,RT Comedian Patton Oswalt will host a fund raiser for a candidate hoping to unseat GOP Rep Steve Knight,2018-03-12 14:19:57,0,261,0
3934,RT ElectionNews Given a choice would you rather be a British Citizen an EU Citizen or Both Do vote amp retweet for a large sample B,2018-03-12 14:19:57,0,484,1
3935,is a Feminist FemiNazi rag,2018-03-12 14:19:57,0,0,0
3936,RT Show and tell and shoot Teacher brings his AR 15 to school Students bring one too on their 18th birthdays Even sooner if t,2018-03-12 14:19:57,0,358,0
3937,RT ElectionNews May s Brexit will block ports and cripple business Time to stop pretending May s Brexit,2018-03-12 14:19:57,0,1,0
3938,RT Qatari officials gathered evidence of what they claim is illicit influence by the UAE on Jared Kushner but decided not to giv,2018-03-12 14:19:56,0,1165,0
3939,RT guttenberg I miss my daughter every minute of every day For anyone who wants to know why I have been triggered and will not sto,2018-03-12 14:19:56,0,33697,1
3940,RT Putin responds to charges of Russian election meddling So what I don t care I couldn t care less,2018-03-12 14:19:56,0,68,-1
3941,RT Getting away sort of from politics for a second,2018-03-12 14:19:56,0,4,0
3942,RT Siskind Trump has a disdain for anyone not white but he seems to hold a whole separate level of hatred for women of color Again,2018-03-12 14:19:55,0,2659,1
3943,RT My case is in the court of law for 5 years now But let my battle not be an excuse to humiliate other women In fact let i,2018-03-12 14:19:55,0,101,-1
3944,RT Maguire Stealing a day s holiday from NHS staff for a cut in living standards dressed up as a 6 5 pay rise is failed Torynomics,2018-03-12 14:19:55,0,227,-1
3945,RT Trump is an NRA sock puppet He won t agree to any solution to gun violence that doesn t involve more guns More guns i,2018-03-12 14:19:55,0,9,1
3946,RT NBC Qatari officials gathered evidence of what they claim is illicit influence by the UAE on Jared Kushner and other,2018-03-12 14:19:55,0,491,-1
3947,RT Ivanka Trump never cut ties with the Trump Organization That s turned into a problem FireIvanka,2018-03-12 14:19:55,0,57,0
3948,RT Conservative 1 000 Jobs Created A Day FTE Tax for 31m 2m more quality school places Record NHS Day to day budg,2018-03-12 14:19:55,0,213,1
3949,58stingray Politics Women have better taste than to sleep with Obama,2018-03-12 14:19:55,1,0,1
3950,RT Raise Your Hand If You Knew 45 Was Never Ever Going To Help Get Mass Murdering Killer Guns Out Of The Hands of Crazi,2018-03-12 14:19:55,0,17,0
3951,RT I have worked as a doctor in Africa Asia Latin America Europe amp USA But the only place I saw a child with a brain t,2018-03-12 14:19:55,0,39,0
3952,RT Education Secretary Betsy DeVos criticizes President Trump s use of vulgarity on the campaign trail to mock Chuck Todd po,2018-03-12 14:19:55,0,11,0
3953,RT PM president to get their own planes by early 2020,2018-03-12 14:19:55,0,8,1
3954,RT It s going to get worse this year It s amazing we carry United in our nation s name still It see,2018-03-12 14:19:55,0,1,1
3955,RT guttenberg I miss my daughter every minute of every day For anyone who wants to know why I have been triggered and will not sto,2018-03-12 14:19:54,0,33697,1
3956,RT Russian President Vladimir Putin says he couldn t care less if Russian citizens tried to meddle in the 2016 US election,2018-03-12 14:19:54,0,50,-1
3957,It is politics BB would had done the same In politics there are no permanent positio,2018-03-12 14:19:54,0,2,0
3958,RT Geez if drug dealers get the death penalty just think about the gruesome punishment for corrupt traitors who sell out democra,2018-03-12 14:19:54,0,2005,-1
3959,Disgusting NBC News Flush with cash and bracing for November the RNC builds an army,2018-03-12 14:19:54,0,0,-1
3960,RT He s funded by Time Warner amp some of the same investment firms that bring you Debbie Wasserman S,2018-03-12 14:19:53,0,6,0
3961,Not everyone who like or love politics Right but take a minute to think about Many will say they don t,2018-03-12 14:19:53,0,0,1
3962,RT Qatari officials gathered evidence of what they claim is illicit influence by the UAE on Jared Kushner but decided not to giv,2018-03-12 14:19:53,0,1165,0
3963,RT Betsy DeVos can t answer basic questions on sexual assault school choice in rough 60 Minutes interview,2018-03-12 14:19:53,0,48,1
3964,RT The Missing Piece in Italian Politics Women,2018-03-12 14:19:53,0,39,-1
3965,RT Betsy DeVos is a shining example of everything that is horrendous with the Trump Administration She is simply not fit to be,2018-03-12 14:19:53,0,859,-1
3966,RT The face of the GOP South Carolina Candidate Proud of Confederacy and Slave Owning Ancestor,2018-03-12 14:19:52,0,630,1
3967,RT Yes people need to tell the truth but we need to keep our focus on what truly matters Why are parents so angry Listen,2018-03-12 14:19:52,0,1,-1
3968,RT That s my story and I m sticking to it Liewatha has spoken,2018-03-12 14:19:52,0,2780,0
3969,RT To have real accountability to restore the rule of law we need the attorney general to do his job and a,2018-03-12 14:19:52,0,46,1
3970,RT Qataris opted not to give info on Kushner secret meetings to Mueller,2018-03-12 14:19:52,0,64,-1
3971,RT will also be the first to give birth while serving in the Senate womenshistorymonth,2018-03-12 14:19:52,0,13,1
3972,RT The face of the GOP South Carolina Candidate Proud of Confederacy and Slave Owning Ancestor,2018-03-12 14:19:51,0,630,1
3973,RT President Trump blames the Democrats for personnel shortages at the State Department,2018-03-12 14:19:51,0,9,0
3974,Sen Mike Lee reintroduces religious freedom bill,2018-03-12 14:19:51,0,0,0
3975,RT sala BJP won a huge majority in Uttar Pradesh If even after that BJP is inducting corrupt leaders like Naresh Agarwal it means,2018-03-12 14:19:50,0,155,-1
3976,Everything is fair in love war and politics ZA,2018-03-12 14:19:50,1,0,1
3977,Let me try one more time Liam Fox has travelled the globe to try with little succes,2018-03-12 14:19:50,0,0,1
3978,RT DeVos calls on Trump to not use foul language,2018-03-12 14:19:50,0,253,0
3979,RT Ivanka while working at the White House is getting paid 1 5 million annually by Trump companies which in turn are doing b,2018-03-12 14:19:50,0,694,0
3980,RT BBC seem disinterested in this How predictable,2018-03-12 14:19:49,0,112,-1
3981,RT White Evangelical Women Core Supporters of Trump Begin Tiptoeing Away,2018-03-12 14:19:49,0,62,0
3982,RT Join me on Facebook live in 2 minutes What does induction of Naresh Agarwal and Narayan Rane in BJP tell,2018-03-12 14:19:49,0,33,1
3983,BJP should do whatever they can to P Chidambaram now Next when PC becomes the FM Modi goes to prison for Demoneti,2018-03-12 14:19:49,0,0,0
3984,You understand it s progressives that use identity politics not Mr Ford,2018-03-12 14:19:49,0,0,0
3985,RT magdalene Women Muslim clerics call for the end of political campaigns that rouse sectarian sentiment ahead of this year and next,2018-03-12 14:19:49,0,2,0
3986,RT Statistics Canada loses mishandles hundreds of sensitive census employment files Some individuals not told of privacy,2018-03-12 14:19:48,0,5,-1
3987,RT Context Is economy doing well under Trump Yes Was it doing well when he took over Yes America has added 2 5 million,2018-03-12 14:19:48,0,188,0
3988,RT Ivanka while working at the White House is getting paid 1 5 million annually by Trump companies which in turn are doing b,2018-03-12 14:19:48,0,694,0
3989,RT Ivanka while working at the White House is getting paid 1 5 million annually by Trump companies which in turn are doing b,2018-03-12 14:19:48,0,694,0
3990,RT guttenberg I miss my daughter every minute of every day For anyone who wants to know why I have been triggered and will not sto,2018-03-12 14:19:48,0,33697,1
3991,RT Ivanka Trump never cut ties with the Trump Organization That s turned into a problem FireIvanka,2018-03-12 14:19:48,0,57,0
3992,RT Poisoned Russia Spy says Putin has a hit out on Christopher Steele Browder among others Good flag by,2018-03-12 14:19:48,0,1372,1
3993,RT sala BJP won a huge majority in Uttar Pradesh If even after that BJP is inducting corrupt leaders like Naresh Agarwal it means,2018-03-12 14:19:47,0,155,-1
3994,Trump s China whisperer How billionaire Stephen Schwarzman has sought to keep the president close to Beijing,2018-03-12 14:19:47,0,0,0
3995,National Union Boss Hails Conor Lamb as God Fearing Gun Owning Democrat via,2018-03-12 14:19:47,0,0,0
3996,RT Trump pardons former Navy sailor imprisoned for taking photos on nuclear submarine,2018-03-12 14:19:47,0,3991,0
3997,RT Politics comes under BHED It s not Naresh Agrawal joined BJP it is the way to demolition the fort of samajwadi NareshAga,2018-03-12 14:19:47,0,3,0
3998,RT If amp can keep on welcoming Gutter Mouth like Naresh Agarwal The day i make up my mind to be in politi,2018-03-12 14:19:47,0,243,0
3999,RT President Trump Will Visit California to Inspect Border Wall Prototypes This Month Watch for protesters to know who the,2018-03-12 14:19:47,0,107,0
4000,RT Two former EPA administrators Bush and Obama era write letter to Scott Pruitt who now has same job to ask him to back do,2018-03-12 14:19:47,0,147,0
4001,RT In today s Democrats win or lose have overperformed in most of the major races over the past year in the Tr,2018-03-12 14:19:47,0,29,1
4002,RT Ivanka while working at the White House is getting paid 1 5 million annually by Trump companies which in turn are doing b,2018-03-12 14:19:46,0,696,0
4003,RT Context Is economy doing well under Trump Yes Was it doing well when he took over Yes America has added 2 5 million,2018-03-12 14:19:46,0,188,0
4004,RT One would have expected public opinion to rally behind the result of the 2016 referendum and support getting on with brex,2018-03-12 14:19:46,0,212,-1
